No,Column1,name,keyword,content,tags,address,address1,경도,위도,상태
115,10324,정물오름,자연,가족과 함께한 제주여행..정물오름에서 제주를보다,"['#제주컬러어택', '#제주', '#정물오름']",제주특별자치도 제주시 한림읍 금악리 산 52-5, 한림읍 ,126.33554695749,33.3390999616981,정좌표
116,10337,종달리해안도로,자연,#제주가을 #제주 가을 #종달리해안도로 #갈대숲 #제주바다,"['#제주가을', '#제주', '#종달리해안도로', '#갈대숲', '#제주바다']",제주특별자치도 제주시 구좌읍 종달리 630-1, 구좌읍 ,126.901766560838,33.4828840549808,정좌표
117,10350,표선세화해안도로,자연,#표선#해안도로#날아라,"['#표선', '#해안도로', '#날아라']",제주특별자치도 서귀포시 표선면 표선리, 표선면 ,126.827638456729,33.3240362050874,인근좌표
118,10387,제주곶자왈도립공원,자연,제주 곶자왈 도립공원에서 찍었습니다~ 즐거운 산책,"['#제주컬러어택', '#제주곶자왈도립공원', '#산책']",제주특별자치도 서귀포시 대정읍 보성리 산 1, 대정읍 ,126.275022458547,33.2892556972941,정좌표
119,10399,한림해안도로,자연,[],[],제주특별자치도 제주시 한림읍 귀덕리, 한림읍 ,126.291856878539,33.4306192576273,인근좌표
120,10411,교래자연휴양림,자연,교래자연휴양림 캠핑장에 안개가 끼면...??,"['#제주가을', '#교래자연휴양림', '#낭만부부']",제주특별자치도 제주시 조천읍 교래리 산 95, 조천읍 ,126.666900253848,33.4373246978984,정좌표
121,10422,금악오름(왕매),자연,가족여행으로 갔던 제주 제주 갈 때마다 오름 한두개씩 오르는데 올라가는 길도 좋고 경치도 너무 좋았던 금악오름,"['##금악오름', '##금오름', '##제주가을', '##제주도']",제주특별자치도 제주시 한림읍 금악리 산 1-1, 한림읍 ,126.305639644299,33.3556769791101,정좌표
122,10444,사계해변,자연,#여름#사계해변#형제해안로,"['#여름', '#사계해변', '#형제해안로']",제주특별자치도 서귀포시 안덕면 사계리, 안덕면 ,126.300092022683,33.2344693974988,인근좌표
123,10466,연화못,자연,#여름 #연화못 #연꽃 #애월,"['#여름', '#연화못', '#연꽃', '#애월']",제주특별자치도 제주시 애월읍 고하상로, 애월읍 ,126.356440318013,33.4475355570562,인근좌표
124,10477,판포포구,자연,제주도민인데요 판포포구 물놀이 갔다가 포구앞 구명조끼 튜브빌러주는곳에 갔다가 기분이 별로네요. 아이들 태워 줄려고 집에 있는 물놀이용 보트 가져가서 바람 넣어줄수 있냐고 물어봤는데 5천원 달래요ㅡㅡ^ 차량용 펌프가 오래걸려서 넣을까 했는데.. 이래서 제주도 물가가 비싸다고 하겠죠? 도민이 이렇게 느끼는데 관광객들이 제주도 비싸다하는 이유가 이런것들이죠~,"['#여름', '#가족', '##판포포구 바가지']",제주특별자치도 제주시 한경면 판포리 2877-3, 한경면 ,126.199675945242,33.3653887306226,정좌표
125,10488,구엄리돌염전,자연,일정이 늦어져 무작정 빛내림만 쫓아 다닌 날..,"['#제주컬러어택', '#', '#구엄리돌염전', '#', '#구엄리', '#', '#대한민국구석구석', '#']",제주특별자치도 제주시 애월읍 구엄리 609-1, 애월읍 ,126.377255745131,33.4830171345325,정좌표
126,10498,물찻오름,자연,비오는날 물찻오름에 올랐어요~ 비가 많이 오면 위험하지만 오를수 있는 정도여서 운좋게 오를수 있었어요~ 올라가기에 어렵지 않고 약 20분이면 정상까지 올라가네요 ~~ :) 1년에 한번만 개방하는 물찻오름 다녀오세요!,"['#물찻오름', '#에코힐링기간', '#제주도']",제주특별자치도 제주시 조천읍 교래길, 조천읍 ,126.682373344724,33.4640809611536,인근좌표
127,10528,공천포,자연,#공천포 #남원 #공천포올래,"['#공천포', '#남원', '#공천포올래']",제주특별자치도 서귀포시 남원읍 신례리, 남원읍 ,126.624357342642,33.3233826656077,인근좌표
128,10546,세화해안도로,자연,#가을제주#월정리해안도로#제주노을,"['#가을제주', '#월정리해안도로', '#제주노을']",제주특별자치도 제주시 구좌읍 구좌로, 구좌읍 ,126.857130216759,33.5231146369935,인근좌표
129,10564,위미항,자연,#2018제주올레축제#외국인과함께걷는제주올레길,"['#2018제주올레축제', '#외국인과함께걷는제주올레길']",제주특별자치도 서귀포시 남원읍 위미리 1757-12, 남원읍 ,126.66378121873,33.2709760954458,정좌표
130,10573,조천함덕해안도로,자연,주말에 혼자 산책 나갔다 발견한 곳 지도에도 나오지 않는 곳!,"['#조천', '#대섬마을', '#양귀비']",제주특별자치도 제주시 조천읍 조천리 3462, 조천읍 ,126.642969168041,33.531374928793,정좌표
131,10582,큰노꼬메오름,자연,큰노꼬메오름의 가을 풍경이다,"['#제주가을', '#큰노꼬메오름', '#가을', '#오름']",제주특별자치도 제주시 애월읍 유수암리 산 138, 애월읍 ,126.415904492199,33.3922213772264,정좌표
132,10599,신창풍차해안도로,자연,즐거운여행,"['#제주컬러어택', '#제주', '#신창해안도로']",제주특별자치도 제주시 한경면 신창리 1322-1, 한경면 ,126.173962062116,33.3434064608785,정좌표
133,10607,오조포구,자연,"조용히 나만의 공간에 선듯, 여유롭게 노을을 감상할 수 있는 곳.",[],제주특별자치도 서귀포시 성산읍 오조리, 성산읍 ,126.904163550679,33.4629317412793,인근좌표
134,10623,톨칸이,자연,우도봉의 동쪽에 검멀레해변이 있다면 서쪽에는 톨카니가 있다고 말할 수있다. 검은 바위들과 푸른하늘바다가 매우 강렬하게 전달되는 아름다운 곳이다. 이곳에 바라보는 일출봉도 대단하다. #톨카니 #우도 #톨카니해변,"['#톨카니', '#우도', '#톨카니해변']",제주특별자치도 제주시 우도면 연평리 1732-1, 우도면 ,126.954927263765,33.4920263511213,정좌표
135,10631,한림항,자연,#한림항 #올레길15-B코스,"['#한림항', '#올레길15']",제주특별자치도 제주시 한림읍 대림리 2019-17, 한림읍 ,126.262649509669,33.419220710854,정좌표
136,10639,고내리포구,자연,"하루종일 흐렸던 날씨, 창밖을보자 마음이 탁 트였습니다 #애월 의 해안도로는 바다보다 매우 높았습니다 해와 화창한 하늘이 마치 구름을 찢고나오는 장면같았습니다 감동적이었던 #제주도 의 바다 그리고 맑고 투명했던 바다 남자친구와 밝은 해와 맑은 해를보고 우린 여전히 사랑해랍니다~ ^♡^","['#애월', '#제주도']",제주특별자치도 제주시 애월읍 고내리, 애월읍 ,126.336893407246,33.4630176864502,인근좌표
137,10653,신창리포구,자연,물이 에메랄드 빛이 에요. 걷기만 해도 좋은 곳이에요~ 가족들과 친구들과 다시한번 가고 싶은 곳이에요! 아무생각없이 걷다보면 스트레스가 다 날아가는거같아요 >_,"['#풍차', '#신창리', '#힐링', '#자연']",제주특별자치도 제주시 한경면 신창리, 한경면 ,126.180403860316,33.3422183957335,인근좌표
138,10660,영주산,자연,#영주산오름 #소들이쉬는들판 #그림같은_새벽을_볼_수_있는곳 풀밭에서 쉬는 소를 바로 옆에두고 했던 아침산책,"['#영주산오름', '#소들이쉬는들판', '#그림같은']",제주특별자치도 서귀포시 표선면 번영로, 표선면 ,126.820156223146,33.3456334481215,인근좌표
139,10667,화순금모래해수욕장,자연,화순에 자장면 먹으러 갔다가 저녁노을 바다가 너무 이뻐서 나두 모르게 핸펀 카메라로 찰칵찰칵~~*,[],제주특별자치도 서귀포시 안덕면 화순리 776-7, 안덕면 ,126.336049507215,33.2396591342296,정좌표
140,10674,곶자왈,자연,"진정한 제주의 곶자왈을 체험할 수 있는 곳. 특히, 문도지오름을 지나 오설록에 이르는 구간은 신비의 비경이다.",[],제주특별자치도 서귀포시 대정읍 신평리, 대정읍 ,126.258488022927,33.2769436940714,인근좌표
141,10686,성산오조리해안,자연,아이와함께한 제주여행^^ 하귤이 많이 열렸네요~~,[],제주특별자치도 서귀포시 성산읍 오조리, 성산읍 ,126.904163550679,33.4629317412793,인근좌표
142,10692,안돌오름,자연,#산과오름 #안돌오름 #밧돌오름,"['#산과오름', '#안돌오름', '#밧돌오름']",제주특별자치도 제주시 구좌읍 송당리 산 66-2, 구좌읍 ,126.756161146457,33.4572288697548,정좌표
143,10704,종달리해변,자연,"지난 겨울에 갔었는데 그렇게 많이 알려지지 않은 곳이라 사람이 많지 않고 조용해서 좋았습니다. 북적대는 곳을 좋아하지 않고 운치있는 곳에서 조용히 생각을 정리하는 여행을 즐기고 싶은 분들에게 추천해드리고 싶어요. 특히, 겨울에 혼자 여행하기 좋은 곳이라고 생각합니다. 조용한 곳이지만, 여행자를 위한 게스트하우스나 식당 같 은 곳은 곳곳에 있어서 불편한 점도 없었습니다.",[],제주특별자치도 제주시 구좌읍 종달리 565-72, 구좌읍 ,126.909728156108,33.496362789685,정좌표
144,10710,천아숲길 천아계곡,자연,#제주가을 #천아숲길천아계곡,"['#제주가을', '#천아숲길천아계곡']",제주특별자치도 제주시 애월읍 봉성리 산 1, 애월읍 ,126.423063368666,33.3542512810296,정좌표
145,10716,청수곶자왈,자연,2018년 8월에 다녀왔습니다. 당시 8월엔 반딧불을 못 본다고 해서 그냥 곳자왈만 탐방하고 왔습니다. 근처에 반딧불 탐방을 관리하는 건물이 있는데 그곳 전화번호를 찾아보시고 예약하고 가시면 될것 같아요. 저는 무턱대고 그냥 찾아갔었어요. 사람들이 많이 안오는 곶자왈이라 조용하고 좋았습니다.,"['#여름', '#걷기', '#가족', '#친구', '#혼자']",제주특별자치도 제주시 한경면 청수리 1571, 한경면 ,126.247672454393,33.3177039666455,정좌표
146,10722,김녕해안도로,자연,[],[],제주특별자치도 제주시 구좌읍 김녕리, 구좌읍 ,126.749270675221,33.5359088830753,인근좌표
147,10732,민오름(구좌읍),자연,민오름 가는 숲길은 너무 멋있지만 화요일 목요일 오후2~4시만 개장하고 요즘민오름 정상은 억새와잡풀 이 무성하다,[],제주특별자치도 제주시 구좌읍 송당리 산 155, 구좌읍 ,126.762222332029,33.4443362326419,정좌표
148,10747,이승이오름(이승악),자연,"#나미송, 이승악에서..  또 언젠가 다른 한 때, 또 다른 한 때의 인연들과 겨울산 하얀길을 걷게 되겠지 이승의 인연으로..",['#나미송'],제주특별자치도 서귀포시 남원읍 신례리 산2-1, 남원읍 ,126.605130274035,33.3641123810906,정좌표
149,10752,"저지오름(닥몰오름,새오름)",자연,놀라운 제주풍경,"['#제주가을', '#올레', '#저지오름']",제주특별자치도 제주시 한경면 저지리 산 51, 한경면 ,126.251018163376,33.3329529783664,정좌표
150,10757,협재굴(한림공원),자연,가족들과 함께 한림공원 여행,"['#제주컬러어텍', '#한림공원', '#푸른자연색']",제주특별자치도 제주시 한림읍 협재리 2487, 한림읍 ,126.239477699894,33.388290186669,정좌표
151,10762,화순곶자왈생태탐방숲길,자연,#화순곶자왈생태탐방숲길 #화순곶자왈 #곶자왈 #산방산,"['#화순곶자왈생태탐방숲길', '#화순곶자왈', '#곶자왈', '#산방산']",제주특별자치도 서귀포시 안덕면 화순리 2045, 안덕면 ,126.330859607035,33.2649504369373,정좌표
152,10767,화순리 유채꽃길,자연,#봄 #제주봄 #유채꽃 #제주유체꽃 #산방산 #노오란밭,"['#봄', '#제주봄', '#유채꽃', '#제주유체꽃', '#산방산', '#노오란밭']",제주특별자치도 서귀포시 안덕면 화순리 1230-4, 안덕면 ,126.333975263713,33.2517638605092,정좌표
153,10776,구좌해안로,자연,아름다운 김녕항과 목지섬 사이... 안녕김녕sea,[],제주특별자치도 제주시 구좌읍 구좌해안로, 구좌읍 ,126.726951756949,33.558853634489,인근좌표
154,10784,두산봉(말미오름),자연,겨울즈음에 제주에 오시는 분들 꼭 방문해보세요. 동부권에 있는 오름 중 거의 유일하게 일출각이 맞는 곳 입니다.,"['#제주컬러어택', '#', '#두산봉', '#', '#말미오름', '#']",제주특별자치도 서귀포시 성산읍 시흥리 산 1-5, 성산읍 ,126.886668291253,33.4692892944104,인근좌표
155,10788,무릉곶자왈,자연,[],[],제주특별자치도 서귀포시 성산읍 시흥리 산 1-5, 성산읍 ,126.886668291253,33.4692892944104,인근좌표
156,10792,빌레못동굴,자연,"아름답고, 진귀한 동굴에 이토록 아픈 과거가 있었다니... 아... 어른, 아이 할 것 없이 29명이 희생을 당했던 이 장소가 아름다운 자연경관과는 대조적으로 아프게 느껴집니다. 동굴에 숨어 언제 발각될지 모를 그 두려움과 배고픔에 얼마나 힘들었을까요.. 상상조차 하기 힘듭니다. 빌레못동굴에서의 하루하루가 매우 지옥같았을 것을.... 앞으로는 더이상 이런 말도안되는 역사는 없어야겠습니다. 숭고한 희생에 묵념을 올립니다. #제주4.3 #빌레못동굴",[],제주특별자치도 제주시 애월읍 어음리 1391, 애월읍 ,126.349781203967,33.4043323896564,정좌표
157,10796,사려니오름,자연,[],[],제주특별자치도 서귀포시 남원읍 한남리 산 2-1, 남원읍 ,126.64628646728,33.3590644243416,정좌표
158,10808,싱계물 공원,자연,빼어난 해안경관이지만 찾는 사람이 드문 곳이다. #싱계물공원,['#싱계물공원'],제주특별자치도 제주시 한경면 신창리 1322-1, 한경면 ,126.173962062116,33.3434064608785,정좌표
159,10812,엉알해안,자연,#엉알해안 #엉알해안산책로 #일몰조망지,"['#엉알해안', '#엉알해안산책로', '#일몰조망지']",제주특별자치도 제주시 한경면 고산리 3427-33, 한경면 ,126.168659348732,33.2988150221878,정좌표
160,10816,엉알해안산책로,자연,#엉알해안산책로 #엉알해변,"['#엉알해안산책로', '#엉알해변']",제주특별자치도 제주시 한경면 고락로, 한경면 ,126.208683432027,33.3009979328148,인근좌표
161,10832,장전리 벚꽃축제길,자연,#제주가을 작년 봄에 갔던 장전리 벚꽃축제입니다. 낮에도 예쁘지만 밤엔 더 예쁜 곳이예요.,['#제주가을'],제주특별자치도 제주시 애월읍 장전리 628-3, 애월읍 ,126.390892559597,33.4428859883429,정좌표
162,10836,전망대(종달리),자연,작지만 아름다웠던 종달리해안도로와 종달리전망대에서 만난 제주봄바다와 제주봄들꽃 #종달리전망대,['#종달리전망대'],제주특별자치도 제주시 구좌읍 종달리 42-5, 구좌읍 ,126.912738612459,33.5035574838204,정좌표
163,10844,조함해안도로,자연,제주도사람인 남자친구의 안내로 조천에서 함덕해수욕장을 가는 해안도로에서 풍경이 너무좋아 차를 멈추고 한참 풍경감상을 했습니다 주민분들만 계셔서 조용히 구경할수있어서 더좋았어요,[],제주특별자치도 제주시 조천읍 조천리 3037-3, 조천읍 ,126.636943618813,33.5438299384671,정좌표
164,10848,큰사슴이오름,자연,#제주 #큰사슴이오름 #가을제주 #억새 #졸븐갑마장길  큰사슴이오름에 올라 잣성을 거쳐 따라비오름까지 걷고 또 걷는 #졸븐갑마장길 가을제주를 제대로 느낄 수 있는 억새천지~ 바람따라 걷는 길!! 아름다운 제주를 오감으로 느껴보시길 추천합니다,"['#제주', '#큰사슴이오름', '#가을제주', '#억새', '#졸븐갑마장길', '#졸븐갑마장길']",제주특별자치도 서귀포시 표선면 중산간동로, 표선면 ,126.565927839455,33.2660373155314,인근좌표
165,10852,형제해안도로,자연,사계리에서 송악산으로 이어지는 아름다운 해안도로로 올레 10코스가 지나가고 드라이브코스로도 아주 좋다.  #산방산 #형제섬 #형제해안도로 #송악산 #드라이브코스,"['#산방산', '#형제섬', '#형제해안도로', '#송악산', '#드라이브코스']",제주특별자치도 서귀포시 대정읍 상모리 1649-1, 대정읍 ,126.280201915177,33.2009825303099,정좌표
166,10856,5.16도로숲터널,자연,#가을가을한제주#5.16도로숲터널,"['#가을가을한제주', '#5']",제주특별자치도 서귀포시 남원읍 신례리 산 2-1, 남원읍 ,126.605130274035,33.3641123810906,정좌표
167,10859,거슨새미오름,자연,비가 와서 오름 입구조차 찾기 힘들었고 쌍둥이형과 헤맸지만 어려움속에서 만난 거슨새미오름은 내가 마치 판타지 소설에 나오는 인물이 되어 환상속을 떠돌아 다니는 느낌이었습니다. 비가 세차게 오다가 그친 후라 더 고요한 숲같은 느낌으로 저에게 다가왔습니다. 약간은 쓸쓸한 느낌이 있었지만 그래도 더 기억이 많이 남는 제주의 거슨새미오름이었습니다. 저는 오름에 맑은 날 보다는 비가 적당히 내리는 날 다시 또 방문해보고 싶어요. 거슨새미오름은 저에게 또 다른 경험을 꿈꾸게 하는 내 인생 첫번째 오름입니다.,"['#제주가을', '#거슨새미', '#신선놀음']",제주특별자치도 제주시 구좌읍 송당리 산 145, 구좌읍 ,126.759618692904,33.4505319597439,정좌표
168,10868,공천포구,자연,#공천포구 #남원읍  서연의집 카페에 구경갔다가 더욱 깊숙히 해안도로따라 들어온 작은 포구 마을 비가 오락가락하는 날씨여서인지 변화무쌍한 역동적인 구름에 둘러쌓인 조용하고 정적이 흐르는 포구였다 그래서 인지 인생샷도 가능!!,"['#공천포구', '#남원읍']",제주특별자치도 서귀포시 남원읍 신례리, 남원읍 ,126.624357342642,33.3233826656077,인근좌표
169,10871,높은오름,자연,#산과오름 #높은오름,"['#산과오름', '#높은오름']",제주특별자치도 제주시 구좌읍 송당리 산 213-1, 구좌읍 ,126.792655420261,33.4573106913362,정좌표
170,10874,단산(바굼지오름),자연,친구와 함께 올랐던 제주 단산! 경사가 가파른 구간이 있어 힘들었지만 정상에서 보는 사각형 모양의 밭들과 풍경은 ????,"['#제주', '#단산', '#바굼지오름']",제주특별자치도 서귀포시 안덕면 향교로 165-23, 안덕면 ,126.289236385539,33.2395876134437,정좌표
171,10880,동거문이오름,자연,#동거문이오름,['#동거문이오름'],제주특별자치도 제주시 구좌읍 종달리 산 70, 구좌읍 ,126.805418236537,33.4487657517833,정좌표
172,10883,동검은이오름(거미오름),자연,제주의 숨은 관광지이자 경관이 매우 빼어난 오름이다. 가을이면 수십가지 꽃들이 피어나서 소소한 아름다움까지 포함한 멋찐곳이다. 오름 대부분이 초지여서 시아가 가리는 곳이 거이 없다.! #동검은오름 #동검은이오름 #거미오름 #숨은비경,"['#동검은오름', '#동검은이오름', '#거미오름', '#숨은비경']",제주특별자치도 제주시 구좌읍 종달리 산 70, 구좌읍 ,126.805418236537,33.4487657517833,정좌표
173,10892,북오름,자연,[],[],제주특별자치도 서귀포시 안덕면 동광리 산 94, 안덕면 ,126.33207798731,33.302652758376,정좌표
174,10895,붉은오름(표선면),자연,제주에 살면서도 60평생 처음접한 붉은오름 왜 이제야 왔을까 하는 생각이 뇌리를 스쳤다. 쾌적한 숲길과 새소리 바람소리 사슴이 노니는 정겨운 자연을 만끽하며 힐링의 시간을 보낼수 있었다. 불은오름 탐방코스중 해맞이 숲길의 시점과 종점의 출입구 사이는 불과 10미터정도다. 그렇다면 요즘 코로나19로 인한 비대면운동이 한창인데 기왕이면 한쪽방향으로 탐방을 하면 좋지않을까 하는 생각도 들었다. 예를들어 종점출입구에는 이곳은 출구입니다 비대면을 위하여 우측 10미터 시점에서 들어가 주십시요라는 팻말이 있었으면하는 바램입니다. 구경 잘 하였습니다. 보수림 올림,"['#여름', '#가족여행', '#가족']",제주특별자치도 서귀포시 표선면 가시리 산 158, 표선면 ,126.671038081597,33.3956489227053,정좌표
175,10901,송악산 진지동굴,자연,#송악산진지동굴 에서 본 산방산과 마라도 가는 유람선 - - 지금은 송악산진지동굴 몇군데가 붕괴 되어서 접근불가입니다,['#송악산진지동굴'],제주특별자치도 서귀포시 대정읍 상모리, 대정읍 ,126.275809330658,33.2182814175367,인근좌표
176,10910,월정리해안도로,자연,제주를 방문한 관광객이라면 월정리 해변은 꼭 가보셔야 합니다! 에메랄드 빛 바다가 아주 아름다운 월정리 해변근처에는 맛집과 예쁜 카페들도 많아요 !,"['#제주도', '#월정리해변', '#월정리']",제주특별자치도 제주시 구좌읍 월정리 652-4, 구좌읍 ,126.795924750156,33.5562067727066,정좌표
177,10913,자구네포구,자연,가치있는 목적에 충실할 것.,[],제주특별자치도 제주시 한경면 고산리, 한경면 ,126.186795794326,33.3013674027416,인근좌표
178,10916,하도리 철새도래지,자연,#하도리 #비젠빌리지 #철새도래지 #낭만스냅 #하도리스냅 #정성우 #메멘토 #제주도버스킹 #커플스냅 #하도리사진관 #제주도여행,"['#하도리', '#비젠빌리지', '#철새도래지', '#낭만스냅', '#하도리스냅', '#정성우', '#메멘토', '#제주도버스킹', '#커플스냅', '#하도리사진관', '#제주도여행']",제주특별자치도 제주시 구좌읍 하도리 53-2, 구좌읍 ,126.896375372111,33.5104086666914,정좌표
179,10919,협재포구,자연,"제주에서 제일 핫한 관광지, 유명한 맛집 검색 이런 것들 말고도 우리가 할 수 있는 것들은 얼마든지 많다.  #여름 #제주 #제주서쪽 #협재 #협재포구","['#여름', '#제주', '#제주서쪽', '#협재', '#협재포구']",제주특별자치도 제주시 한림읍 협재리, 한림읍 ,126.24979018754,33.3819986145725,인근좌표
180,10925,고산일과해안도로,자연,#고산일과해안도로 #해안도로 #드라이브코스,"['#고산일과해안도로', '#해안도로', '#드라이브코스']",제주특별자치도 서귀포시 대정읍 영락리 2169, 대정읍 ,126.214309612796,33.2575759385694,정좌표
181,10927,노을해안로,자연,#대정읍노을해안로 #노을해안로 #풍경좋은곳 #대정읍 #드라이브코스,"['#대정읍노을해안로', '#노을해안로', '#풍경좋은곳', '#대정읍', '#드라이브코스']",제주특별자치도 서귀포시 대정읍 일과리 1424-1, 대정읍 ,126.224433333474,33.2425482254925,정좌표
182,10929,당오름,자연,#제주가을 #오름 #당오름,"['#제주가을', '#오름', '#당오름']",제주특별자치도 제주시 구좌읍 송당리 산 199-1, 구좌읍 ,126.777230250209,33.467214709107,정좌표
183,10931,당오름(한경면),자연,"제주 올레12 코스를 따라 걷다보면 작은 당산봉이 나온다. 산길을 따라 계속 깊이 들어가면 등산로, 해변쪽을 따라 걸으면 생이기정바당길이다. 이 길을 따라 걸으면 차귀도의 모습을 부채꼴로 돌아가며 감상할 수 있는데 그 절경이 보아도 보아도 질리지 않는다. 새들이 절벽에 모여있다가 똥을 누어 생긴 하얀 무늬가 보인다는데 그거 찾아보는 것도 묘미!",[],제주특별자치도 제주시 한경면 용수리 산 18, 한경면 ,126.173617026282,33.3082493586948,정좌표
184,10933,"대수산봉(큰물뫼,물미오름)",자연,가족들과 함께 한 첫 제주여행!!!! 넘 행복했던... 추억이 되었네요!!!!! 제주는 역시 사랑입니다...^^,[],제주특별자치도 서귀포시 성산읍 고성리 2040-1, 성산읍 ,126.899054685024,33.4398371687844,정좌표
185,10935,대정해변(하모해변),자연,소나무 그늘이래에서 무료 캠핑이 가능한 하모해수욕장 백사장이 있어 해수욕도 가능하고 겨울엔 방어로 유명한 모슬포항도 근처에 있음,"['#모슬포항', '#방어회', '#하모해수욕장', '#무료캠핑장']",제주특별자치도 서귀포시 대정읍 하모리, 대정읍 ,126.253816794316,33.2199672278167,인근좌표
186,10939,둔지봉,자연,#산과오름 #둔지봉에서,"['#산과오름', '#둔지봉']",제주특별자치도 제주시 구좌읍 한동리 산 40, 구좌읍 ,126.794294912283,33.5016766812285,정좌표
187,10941,모구리오름,자연,모구리 오름은 말굽형 모양의 오름이다. 모구리 오름 내부에는 작은 알오름이 있는 이중구조의 오름으로 높이가 높지 않아서 누구나 쉽게 찾을 수 있다. 분화구 내부는 바람이 거의 불지 않고 삼나무가 많아서 겨울철에서 힐링하기 좋은 곳이다. #모구리오름 #삼나무숲 #삼나무길,"['#모구리오름', '#삼나무숲', '#삼나무길']",제주특별자치도 서귀포시 성산읍 난산리 2971, 성산읍 ,126.82172962722,33.4068352429415,정좌표
188,10943,모지오름,자연,#산과오름 #모지오름,"['#산과오름', '#모지오름']",제주특별자치도 서귀포시 표선면 성읍리 산 22, 표선면 ,126.770221863064,33.3951049684173,정좌표
